{
  "format": "tsuyomi-transfer",
  "version": 5,
  "createdAt": "2026-09-14T00:00:00Z",
  "library": [
    {
      "identity": {
        "sourceId": "org.tsuyomi.wenku8",
        "remoteBookId": "pinned-member"
      },
      "title": "Pinned semantic bookmark fixture",
      "shelfIds": ["favorites"],
      "localPin": true,
      "updatedAt": "2026-09-14T00:00:00Z",
      "completedChapterIds": ["chapter-1"],
      "bookmarks": [
        {
          "document": {
            "sourceId": "org.tsuyomi.wenku8",
            "remoteBookId": "pinned-member",
            "contentId": "chapter-2",
            "revision": "r1"
          },
          "blockId": "paragraph-4",
          "textAnchorDigest": "aaaaaaaaaaaaaaaaaaaaaaaaaaaaaaaaaaaaaaaaaaaaaaaaaaaaaaaaaaaaaaaa",
          "characterOffset": 0,
          "chapterProgress": 0.2,
          "bookProgress": 0.1,
          "capturedAt": "2026-09-14T00:00:00Z"
        },
        {
          "document": {
            "sourceId": "org.tsuyomi.wenku8",
            "remoteBookId": "pinned-member",
            "contentId": "chapter-2",
            "revision": "r1"
          },
          "blockId": "paragraph-4",
          "textAnchorDigest": "bbbbbbbbbbbbbbbbbbbbbbbbbbbbbbbbbbbbbbbbbbbbbbbbbbbbbbbbbbbbbbbb",
          "characterOffset": 42,
          "chapterProgress": 0.9,
          "bookProgress": 0.8,
          "capturedAt": "2026-09-14T00:00:01Z"
        }
      ]
    },
    {
      "identity": {
        "sourceId": "org.tsuyomi.wenku8",
        "remoteBookId": "retained-unpinned"
      },
      "title": "Retained semantic bookmark metadata fixture",
      "localTags": ["favorite"],
      "rating": 4,
      "readLater": true,
      "localPin": false,
      "updatedAt": "2026-09-14T00:00:00Z",
      "completedChapterIds": [],
      "bookmarks": [
        {
          "document": {
            "sourceId": "org.tsuyomi.wenku8",
            "remoteBookId": "retained-unpinned",
            "contentId": "chapter-9"
          },
          "chapterProgress": 0,
          "capturedAt": "1970-01-01T00:00:00Z"
        }
      ]
    }
  ],
  "shelves": [
    {
      "id": "favorites",
      "name": "Favorites",
      "position": 0
    }
  ],
  "preferences": {
    "reader": {
      "flow": "dual",
      "fontScale": 1.2,
      "lineHeight": 1.6,
      "theme": "nightInk",
      "horizontalMargin": 24,
      "paragraphSpacing": 12,
      "lockPortrait": false,
      "progressVisible": true,
      "immersive": false,
      "keepAwake": true,
      "volumePaging": true,
      "fontFamily": "serif",
      "fontWeight": 500,
      "letterSpacing": 0.1,
      "firstLineIndent": 1.5,
      "verticalMargin": 32,
      "textAlignment": "justify",
      "foregroundColor": "#112233",
      "backgroundColor": "#AABBCC"
    }
  }
}
